YEAR	TYPE	TRANSCRIPT	ID	TITLE	SOURCE	ICON	OVERVIEW
1961	Document	https://drive.google.com/open?id=0B979i_9iBTwnUjU4N01yME5Ock0	1961_program_sri	Program on Human Effectiveness	https://drive.google.com/open?id=0B979i_9iBTwnUjU4N01yME5Ock0	https://puu.sh/qwJG0.jpg	Human beings face ever more complex and urgent problems, and their effectiveness in dealing with these problems is a matter that is critical to the stability and continued progress of society. A human is effective not just because he applies to a problem a high degree of native intelligence or physical strength (with a full measure of motivation and purposefulness), but also because he makes use of efficient tools, methods, and strategies. These latter may be directly modified for increased effectiveness. A plan to systematically evolve such modifications has been developedl at Stanford Research Institute. The plan is a long-range one and is based on the premise that a strong, coordinated attack is necessary if significant progress is to be made. The possibilities we are pursuing involve an integrated man-machine working relationship, where close, continuous interaction with a computer avails the human of radically changed information-handling and -portrayal skills, and where clever utilization of these skills provides radical changes in the way the human attacks problems. Our aim is to bring significant improvement to the real-life problem-solving effectiveness of individuals. Tt is felt that such a program competes in social significance with research toward harnessing thermonuclear power, exploring outer space, or conquering cancer, and that the potential payoffs warrant a concerted attack on the principal problem areas.  The basic concept of utilizing technological aids in close cooperation with an individual's detailed problem-solving activities is not new. Indeed, our books, pencils and typewriters attest to a long evolution of the concept. In recent yearst however, a number of basically new approaches to the problem have been initiated. Several researchers (2-8) have pointed out the gains offered by close integration of modern information-handling equipment with the human problem solver. Many contributions have been made in different disciplinary areas--e.g. human engineering, problem-solvillg and educational psychology, linguistics, computer programming, electronic display systems, computer time sharing, operations research, management science, systems engineering, and industrial engineering--all of which appear to form part of a normal evolutionary development toward increased understanding of man-machine integration problems. Also, a number of efforts (9-13) are under way that bear more directly upon the type of man-computer cooperation envisaged in our program; however, none of these has revealed as basic an approach as that proposed herein. Perhaps the most useful work to guide our early activities is that in artificial intelligence and heuristic programming (14-16), where problem-solving processes and nlethods of approach have been developed for totally man-made systems.
1962	Document	.	1962_pub_sri	Augmenting Human Intellect: A Conceptual Framework	http://www.dougengelbart.org/pubs/papers/scanned/Doug_Engelbart-AugmentingHumanIntellect.pdf	https://puu.sh/qwKiO.jpg	This is an initial summary report of a project taking a new and systematic approach to improving the intellectual effectiveness of the individual human being. A detailed conceptual framework explores the nature of the system composed of the individual and the tools, concepts, and methods that match his basic capabilities to his problems. One of the tools that shows the greatest immediate promise is the computer, when it can be harnessed for direct on-line assistance, integrated with new concepts and methods.
1963	Document	https://drive.google.com/open?id=0B979i_9iBTwnQnVxU2pSNjIweWs	1963_binarykeyset_research	Binary-Keyset Code	https://drive.google.com/open?id=0B979i_9iBTwnQnVxU2pSNjIweWs	http://dougengelbart.org/images/pix/img0030.jpg	Current code for five-key handset, providing beginning of shortharrl features, and discussion of future bina:ry-keyset transcription possibilities. 
1963	Document	https://drive.google.com/open?id=0B979i_9iBTwnYmRvNFlucTNkN2M	1963_preliminarythoughts_research	Preliminary thoughts on using our computer facilities...	https://drive.google.com/open?id=0B979i_9iBTwnYmRvNFlucTNkN2M	http://puu.sh/qxIe3.jpg	Real-time feedback during writing or debugging a program, and the management of a program-design records (instruction listings, flow-diagram-like listings, etc. ) are cited as the two most likelY special aspects of our computer-aided working system to concentrate upon in the next few months, and some general discussion of the latter is given. 
1963	Document	https://drive.google.com/open?id=0B979i_9iBTwndG11T0lvclQyeEU	1963_researchplanning_research	Records, Skill, and our Research Planning 	https://drive.google.com/open?id=0B979i_9iBTwndG11T0lvclQyeEU	http://puu.sh/qxIfD.jpg	Points up central importance of the "coordinated working system" that is to represent both our environment and our subject of research. Anticipated requirements for nerw concentration on the recording of our thoughts and actions and for learning and using new skills are pointed out as immediately visible changes in our working life. 
1967	Document	.	1967_pub_ieee	Display-Selection Techniques for Text Manipulation	http://www.dougengelbart.org/pubs/augment-133184.html	http://web.stanford.edu/dept/SUL/library/extra4/sloan/mousesite/Archive/AugmentingHumanIntellect62/Display1967Fig2.gif	Tests and analysis to determine the best display selection techniques for a computer-aided text-manipulation system reveal that the choice does not hinge on the inherent differences in target-selection speed and accuracy between the different selection devices. Of more importance are such factors as the mix of other operations required of the select-operation hand, the ease of getting the hand to and gaining control of a given selection device, or the fatique effects of its associated operating posture. Besides a light pen, several cursor-controlling devices were tested, including a joystick and an SRI-developed device known as a "mouse." The study was aimed directly at finding the best display selection means for our own text-manipulation system but generalizations applicable to other types of on-line systems were derived.
1968	Video	https://drive.google.com/open?id=0B979i_9iBTwnZ3ZIN1pJY3BuODg	1968_demo_fjcc	Mother of All Demos	https://www.youtube.com/watch?v=yJDv-zdhzMY	https://puu.sh/qwKxT.jpg	Demo
1968	Document	.	1968_pub_afips	A Research Center for Augmenting Human Intellect	http://www.dougengelbart.org/pubs/augment-3954.html	http://puu.sh/qwKKp.jpg	This paper describes a multisponsor research center at Stanford Research Institute in man-computer interaction.  For its laboratory facility, the Center has a time-sharing computer (65K, 24-bit core) with a 4.5 megabyte swapping drum and a 96 megabyte file-storage disk. This serves twelve CRT work stations simultaneously.  Special hardware completely removes from the CPU the burden of display re freshing and input sampling, even though these are done directly out of and into core.  The display in a user's office appears on a high-resolution (875-line) commercial television monitor, and provides both char acter and vector portrayals. A relatively standard typewriter keyboard is supplemented by a five-key handset used (optionally) for entry of control codes and brief literals. An SRI cursor device called the "mouse" is used for screen pointing and selection.  The "mouse" is a hand-held X-Y transducer usable on any flat surface; it is described in greater detail further on.  Special-purpose. high-level languages and associated compilers provide rapid, flexible development and modification of the repertoire of service functions and of their control procedures (the latter being the detailed user actions and computer feedback involved in controlling the application of these service functions) .  User files are organized as hierarchical structures of data entities, each composed of arbitrary combinations of text and figures. A repertoire of coordinated service features enables a skilled user to compose, study, and mod ify these files with great speed and flexibility, and to have searches, analyses data manipulation, etc. executed. In particular, special sets of conventions, functions, and working methods have been developed to air programming, logical design, documentation, retrieval, project management, team interaction, and hard copy production.
1970	Document	.	1970_pub_mcn	Intellectual Implications of a Multi-Access Computer...	http://www.dougengelbart.org/pubs/augment-5255.html	http://puu.sh/qwKIk.jng	None
1972	Document	.	1972_pub_ccc	Coordinated Information Services for a Discipline...	http://www.dougengelbart.org/pubs/augment-12445.html	http://puu.sh/qwKN4.jpg	Generally, adoption of a multi-access computer network is promoted on the basis of increased accessibility and economy of computational and data-bank resources for a distributed community of users. But visualize this resource-sharing computer network as a general-purpose digital-packet transportation system linking resources, processors, vendors, brokers, customers, etc.; then consider that the existence of such a transportation system will inevitably stimulate growth of an information market involving many processes, products, and services. A distributed community availing itself of such a transportation system should rightfully count on such market development for much of its payoff from its early investment.  In particular, the "Knowledge Workshop" services described below will grow to become very important to network-coupled communities that are involved with a common discipline or mission -- my judgement is that this use of computer networks will come to dominate over the purely computational use in scale and generally perceived social worth, with today's type of computer services being seen as but a special subset of the tools integrated into a coherent knowledge workshop.
1973	Document	.	1973_pub_afips	Design Considerations for Knowledge Workshop...	https://www.computer.org/csdl/proceedings/afips/1973/5081/00/50810221.pdf	http://puu.sh/qwLFn.jpg	The theme of this paper ties directly to that developed in a concurrent paper "The Augmented Knowledge Workshop," [1], and assumes that: "intelligent terminals" will come to be used very, very extensively by knowledge workers of all kinds; terminals will be their constant working companions; service transactions through their terminals will cover a surprisingly pervasive range of work activity, including communication with people who are widely distributed geographically; the many "computer-aid tools" and human services thus accessible will represent a thoroughly coordinated "knowledge workshop"; most of these users will absorb a great deal of special training aimed at effectively harnessing their respective workshop systems -- in special working methods, conventions, concepts, and procedural and operating skills.  Within the Augmentation Research Center (ARC), we have ten years of concentrated experience in developing and using terminal systems whose evolution has been explicitly oriented toward such a future environment; from this background, two special topics are developed in this paper:  What we (at ARC) have learned about controlling interactive-display services, and the means we have evolved for doing it -- the particular devices (mouse, keyset, keyboard), feedback, and protocol/skill features; and design data, usage techniques, learnability experience, and relevant needs and possibilities for alternatives and extensions.  Our considerations and attitudes regarding the distribution of functions between terminal and remote/shared resources -- including assumptions about future-terminal service needs, our networking experience, and foreseen trends in the associated technologies.  The references [2-19] include considerable explicit description of developments, principles, and usage (text, photos, and movies) to support the following discussion. Annotation is included, not only to provide a guide for selective follow up, but also to supplement the substance to the body of the paper by the nature of the commentary.
1975	Document	.	1975_pub_compcon	NLS Teleconferencing Features: The Journal and...	http://www.dougengelbart.org/pubs/augment-33076.html	http://www.computerhistory.org/fellowawards/_media/img/objects/Engelbart-Douglas-4698Engl.JPG	NLS is an extensive system of computer aids being evolved toward supplying a coherent, comprehensive environment in which a knowledge worker can do all of his central, everyday work. Support for collaborative dialogue among distributed participants is one important component of the system.  The Journal is an NLS subsystem with basic methods for handling full-text computerized items that parallel those of open-literature professional journals and associated library services -- i.e. a permananent record of any published item, citation conventions by which later readers can retrieve and access references to other items, and catalogs and indices for retrieval aid. Each of these processes is done much faster in our computer environment, and other computerized services may be added. Altogether this provides a very powerful foundation for a new level of collaboration via recorded dialogue.  The Shared-Screen Telephone option for conference collaboration stems from a special "connection" feature in NLS that enables mutually agreeing users of Display NLS (DNLS) to connect through the computer system, sharing the same NLS control and display portrayal. When simultaneously talking on the telephone and making use of NLS's other extensive features, two people can confer very effectively at great distances.  Our experience with these "teleconferencing" provisions brings out two important points: (1) computer-aided teleconferencing is much enhanced when integrated coherently with effective computer aids for doing one's other knowledge-work operations, and (2) computer networks add critically important capabilities to this enhanced form of telconferencing.
1978	Document	.	1978_pub_jem	Toward Integrated, Evolutionary Office Automation...	http://www.dougengelbart.org/pubs/augment-71279.html	https://tribute2doug.files.wordpress.com/2013/11/248-07-wke-workstation-1968.jpg	Office Automation involves the planned application of integrated information handling tools and methods to improve the productivity of people in office operations. Although the handling of information by office people is the focus of this new technology, other aspects of the office will be affected. These include factors such as the organization of functions and lines of reporting, training for new methods, work space design, travel patterns, branch office location, home vs office work, hours of work, employee morale, and job classifications. Organizations that harness office automation products will need to deal with many more than just technological issues.  About 22% of the US work force is now in the office, with that percentage rising. Labor costs account for about 70% of the total office costs in our economy and salary costs are increasing about 6% each year. During the past 15 years there has been relatively little increase in productivity of the office work force, contrasting with the manufacturing sector where the average productivity has more than doubled (1). The cost of new technology aimed at increasing the productivity of office workers is going down, while the capabilities of office automation systems have been rapidly increasing.  Office automation will impact industry and government organizations in very significant ways with both COST DISPLACEMENT and VALUE-ADDED results. These two terms are now being used by people who are considering the potential payoffs of office automation to their organizations.  Cost displacement applications have the objective of achieving overall reductions in support staff costs or of increasing work volumes without adding support staff. Such applications typically center around WORD PROCESSING and provide the base for the more advanced value-added applications.  Value-added applications are viewed as being directed toward improving managerial and professional staff productivity (and effectiveness) through use of more integrated office automation systems that can directly affect their work.  The value-added approach deals with far more fundamental issues than the replacement of some support staff positions with word processing pools. Its focus upon individuals and groups of managers and professionals as targets for productivity improvement brings with it opportunities for significant increases in organizational effectiveness and major cost benefits in the largest segment of the office cost spectrum.  For any organization, management choices at many levels will affect the balance between reducing total office costs (cost displacement) or increasing the total office effectiveness (value-added effects).  Word processing applications have, until recently, been equated with the term office automation. It is interesting to note that, on the average, typing tasks comprise only 30% of the secretaries' and typists' work -- and thus account for only about 2% of the total office salaries (2). The next few years will see a very rapid growth in the introduction of advanced technology into offices and in applications with more impact on managers and other non-clerical people, bringing with it broadened perceptions of what office automation really includes.  Office Automation is likely to become one of the fastest-growing and most significant new industries of the century. It will apply electronic technology to a broad new set of applications and bring significant change to many of the ways in which people and organizations work -- AUGMENTING their capabilities and increasing both the quantity and quality of their contributions.
1982	Document	.	1982_pub_afips	Toward High-Performance Knowledge Workers	http://www.dougengelbart.org/pubs/augment-81010.html	http://www.dougengelbart.org/images/pubs/papers/augment-81010/81010_01.gif	Among the on-line knowledge workers of tomorrow, there will be found as always a wide distribution both in personal motivation and flexibility, and in organizational roles and responsibility levels. In this view of the future, two things stand out for me: the workstations and work products of all of the workers must be inter-connected; and special roles for high-performance knowledge workers within this inter-linked organizational and informational network will be extremely important. This paper outlines a framework stemming from this perception toward developing high-performance knowledge workers as part of the evolutionary strategy of a knowledge organization.  In the early 60's when I began active, funded research in this area, well before the term "Office Automation" had emerged, I referred to my work as "Augmenting the Human Intellect." (References [1] and [2] summarize events and results for me and my co-workers over the intervening years.)  About ten years ago I re-named our pursuit, after reading Peter Drucker's discussions [3] about "knowledge workers," "knowledge organizations," and "knowledge industries." It seemed that a better term for the work would be "Augmenting the Knowledge Worker." From this new perspective, a natural image emerged of a "Knowledge Workshop" as the place where a knowledge worker does his work and where, if we extended his tools, his means of collaborative communication, his working methods and his organizational roles, we could speak of an "Augmented Knowledge Workshop." 
1982	Document	.	1982_pub_stanford	Evolving the Organization of the Future: A Point of View	http://www.dougengelbart.org/pubs/augment-80360.html	http://puu.sh/qwLyL.jpg	For over two decades, I have been actively committed to the pursuit of something that I initially called "Augmenting the Human Intellect" -- integrating interactive computer tools into the minute-by-minute activities of people over their whole range of think work. (The attached reprint, Ref1, summarizes events and results over this period.) I re-named the pursuit about ten years ago, after reading Peter Drucker's discussions (Ref-2) about "knowledge workers," "knowledge organizations," and "knowledge industries." I decided that a better term would be "Augmenting the Knowledge Worker." And, from that perspective, a natural image emerged of a "Knowledge Workshop" as the place where a knowledge worker does his work -- and where, if we extended his tools, his means of collaborative communication, his working methods and his organizational roles, we could speak of an "Augmented Knowledge Workshop."  As to be expected, my viewpoint has steadily evolved over the years: many inter-related concepts and elements gradually settled into an ever-more comprehensive and consistent framework. In recent years, my pursuit has often been identified as belonging in the emergent fields of Office Automation and The Office of The Future. In a generally useful way, this is true enough. But there are frequent, large differences -- mostly stemming from differences in viewpoint. I think the major difference is that I have come to sense a much larger scale of opportunity and probable impact than I originally did. This paper attempts to summarize those aspects of my framework that relate to this issue of scale. 
1984	Document	.	1984_pub_afips	Collaboration Support Provisions in AUGMENT	http://www.dougengelbart.org/pubs/oad-2221.html	http://dougengelbart.org/images/pix/img0022.jpg	AUGMENT is an integrated system of knowledge-worker tools that originated at SRI International over an extended period under the sponsorship of NASA, DARPA and RADC. (The system was then named "NLS.") Commercial rights were transferred to Tymshare in 1978, where it has since been enhanced and marketed as an integrated Office Automation system. A short history of AUGMENT's development may be found in [Ref-1], along with a summary of system characteristics and features.  The system evolved on time-shared, mainframe computers, and in a packet-switched network environment. In 1970 our computer was the second to be attached to the ARPANET, and since 1978 we have also operated extensively in the TYMNET environment. Special attributes of each the timesharing and the network environments contribute uniquely to the support of collaboration.  The architecture and general character of AUGMENT were directly oriented toward augmenting the capability of humans to deal with tough knowledge work and to process effectively the large volumes of information that burden the modern office. An explicit sub-goal was to support close, active collaboration among groups of workers. In this spirit, we volunteered to develop and operate the Network Information Center (NIC) for the original ARPANET user and research community, aiming to learn about collaborative support by really doing it.  Below are listed the primary community activities which we aimed to support in providing "coordinated information services for a discipline- or mission-oriented community" -- shown in the order recommended for evolutionary implementation. The rationale for the selection and ordering of these particular activities, and the approach for providing computerized support for them, were described in [Ref-2]:  A1: Collaborative Dialog A2: Document Development, Production, and Control A3: Research Intelligence A4: Community Handbook Development A5: Computer-Based Instruction A6: Meetings and Conferences A7: Community Management and Organization A8: Special Knowledge Work by Individuals and Teams  The range of services conceived for this purpose had a major effect upon the system architecture and user features. However, the ARPANET user community grew much faster than was planned for, so this range had to be trimmed considerably and much less exploratory support development was carried out than was planned for. As a consequence, it was only for the first two of these activities that enough resources were available for developing significant computerized support.  [Note: The NIC remained at SRI when the rest of the Augmentation Research Center left, and is healthily serving a very sizeable community.]  This paper summarizes some of the principles, concepts and special provisions embodied in AUGMENT that most directly provide this collaborative support.
1984	Document	.	1984_pub_compcon	Authorship Provisions in AUGMENT	http://www.dougengelbart.org/pubs/oad-2250.html	http://puu.sh/qwLVH.jpg	AUGMENT is a text processing system marketed by Tymshare for a multi-user, network environment. In AUGMENT's frontend is a User Interface System that facilitates flexible evolution of command languages and provides optional command recognition features. Exceptionally fast and flexible control of interactive operations is enabled by concurrent action of mouse and optional one-handed chord keyset. Files are hierarchically structured, and textual address expressions can flexibly specify any text entity in any file. The screen may be divided into arbitrary, rectangular windows, allowing cross-file editing between windows. Many options exist for controlling the "view" of a file's text in a window, e.g.: level clipping, paragraph truncation, and content filtering. Structural study and modification of on-line documents are especially facilitated. A Journal system and "Shared Screen Teleconferencing" support collaboration among authors and their colleagues. Graphic illustrations may be embedded in the same file with text.
