YEAR	TYPE	TRANSCRIPT	ID	TITLE	SOURCE	ICON	OVERVIEW
1986	Video	https://drive.google.com/open?id=0B979i_9iBTwnZXRsMFlWdWtIMjA	1986_workshop_acm	Augmented Knowledge Workshop	https://archive.org/details/XD302_86ACM_Prese_AugKnowledgeWorkshopParts1and2	http://puu.sh/qwLY2.jpg	Workshop
1987	Video	https://drive.google.com/open?id=0B979i_9iBTwnUndCUmRjN1hLMHc	1987_demo_stanford	Demo of Augment System	https://archive.org/details/XD1940_87_DescripDemoAugmentSys	http://puu.sh/qwM5p.jpg	Demo
1989	Video	https://drive.google.com/open?id=0B979i_9iBTwnRmhhS2RYVURtY00	1989_keynote_interop	Interop-89 Keynote	https://archive.org/details/XD1907_89Interop-89GenSes1KeynoteSpkr	http://puu.sh/qwMhq.jpg	Keynote
1990	Video	https://drive.google.com/open?id=0B979i_9iBTwnZWJDYzBJTHJ5RjQ	1990_demo_norton	Norton’s Augment Handbook Demo	https://archive.org/details/XD1719_90AugmentHandbk.cdr	http://puu.sh/qwMmo.jpg	Demo
1990	Video	https://drive.google.com/open?id=0B979i_9iBTwnZF92MHJxMTVHeDA	1990_lecture_mitre	Co-evolution of Technology and Organizations	https://archive.org/details/XD1933_90MItreCoEvolofTechandOrg	http://puu.sh/qwMj6.jpg	Lecture
1990	Document	.	1990_pub_cscw	Knowledge-Domain Interoperability and an Open...	http://www.dougengelbart.org/pubs/augment-132082.html	http://www.dougengelbart.org/images/pubs/papers/augment-132082/132082_01.gif	This paper anticipates that the tools and methods of computer-supported cooperative work (CSCW) will become harnessed with revolutionary benefit to the ongoing, everyday knowledge work within and between larger organizations. Toward that end, the following needs for interoperability between knowledge-work domains will have to be met, and something such as the "open hyperdocument system" must become available for widespread use.  As computers become cheaper and we learn more about harnessing them in our cooperative work, they will come to support an increasing number of different domains of knowledge work. Moreover, the sphere of computer-supported activity within each domain will steadily expand as more function and more skill become employed.  It is predictable that increasing functional overlap will occur as these expanding domains begin to overlap. It has become apparent to me that someday all of our basic knowledge-work domains will be integrated within one coherent "organizational knowledge workshop." This leads to thinking about an over-all, integrated architectural approach to the ever larger set of common knowledge work capabilities emerging within a multi-vendor environment.  Much has been accomplished to date in standards and protocols in the highly active field of networked workstations & servers, where "interoperability between hardware and/or software modules" has become a central theme.  This paper considers the "interoperability between knowledge domains." This interoperability theme will be increasingly important for a workable CSCW framework as the scope and degree of CSCW increases. Dramatic increases will predictably create a marked paradigm shift about how to organize and operate cooperative human endeavors. I think that two phenomena will yield changes and a paradigm shift that will make this interoperability of paramount importance:  with a relatively unbounded technological frontier together with immense and growing economic pressure, the speed, size and cost of computers, memory, and digital communications will continue improving by geometric progression;  awareness and importance of CSCW is emerging, with a predictable trend toward our doing more and more of our personal and cooperative knowledge-work online.  Assuming an inevitably gigantic scale for our inter-knit "CSCW world" provides some important guidance for the continuing investment of our business resources and professional time.  For one thing, each year earlier that an effective degree of knowledge-domain interoperability is in place within important organizational or institutional domains could be worth hundreds of millions of dollars -- could mean the difference between vitality and sluggishness.  And for another, we would prefer to avoid investing our research, product development, or organizational-change resources toward ends that won't be interoperably compatible within that future, radically different paradigm.
1991	Video	https://drive.google.com/open?id=0B979i_9iBTwnOVNsaVRDWTA2SW8	1991_demo_xerox	High Performance Knowledge Work: User Interfaces and Enterprise...	https://archive.org/details/XD317_1991HighPerfKnwldgeWorkUsernterfacesEntWideArchPt1	http://puu.sh/qwMqv.jpg	Demo
1993	Video	https://drive.google.com/open?id=0B979i_9iBTwnaWI1WGZMWVo3ZDQ	1993_lecture_ieee	Computer Pioneer Award and Distinguished Lecture	https://archive.org/details/XD318_93CompPioneerAward	http://puu.sh/qwMtJ.jpg	Lecture
1994	Video	http://americanhistory.si.edu/comphist/englebar.htm	1994_interview_smithsonian	Douglas Engelbart Oral History	http://www.dougengelbart.org/history/exhibits.html	http://www.bytecellar.com/wp-content/uploads/2015/07/places_invention_2_1200w.jpg	Interview
1995	Document	.	1995_pub_byte	Dreaming of the Future	http://www.dougengelbart.org/pubs/augment-133189.html	http://dougengelbart.org/images/pubs/papers/augment-133189/1995-byte-photo-dce.jpg	None
1995	Video	https://drive.google.com/open?id=0B979i_9iBTwndmxtSjE2MksyQzg	1995_symposium_mit	Vannevar Bush Symposium	https://archive.org/details/XD1941_1_95VannevarBushSymTape2_DougEngelbart	http://puu.sh/qwMwj.jpg	Symposium
1998	Video	https://drive.google.com/open?id=0B979i_9iBTwnelR4X3RjMXhfaXM	1998_presentation_pg	Presentation at P&G with Todd Garrett	https://archive.org/details/XD1757_98MangmtSystemsGlobleadership	http://puu.sh/qwMzG.jpg	Presentation
1999	Video	https://drive.google.com/open?id=0B979i_9iBTwndHZicHo3VWZudFU	1999_keynote_cscl	Boosting Collective IQ	https://archive.org/details/XD1606_99_BoostingCollID	http://puu.sh/qwMBE.jpg	Keynote
2002	Video	https://drive.google.com/open?id=0B979i_9iBTwnSHZFbzltSGFlZlU	2002_interview_times	Interview by John Markoff of the New York Times	https://www.youtube.com/watch?v=VeSgaJt27PM	http://puu.sh/qwMFo.jpg	Interview
2002	Document	.	2002_pub_byte	Improving Our Ability to Improve: A Call for Investment...	http://www.dougengelbart.org/pubs/augment-133320.html	http://dougengelbart.org/images/pubs/papers/augment-133320/figure_01.gif	In the past fifty years we have seen enormous growth in computing capability - computing is everywhere and has impacted nearly everything. In this talk, Dr. Douglas Engelbart, who pioneered much of what we now take for granted as interactive computing, examines the forces that have shaped this growth. He argues that our criteria for investment in innovation are, in fact, short-sighted and focused on the wrong things. He proposes, instead, investment in an improvement infrastructure that can result in sustained, radical innovation capable of changing computing and expanding the kinds of problems that we can address through computing. In this talk, Dr. Engelbart describes both the processes that we need to put in place and the capabilities that we must support in order to stimulate this higher rate of innovation. The talk closes with a call to action for this World Library Summit audience, since this is a group that has both a stake in innovation and the ability to shape its direction.
2004	Video	https://drive.google.com/open?id=0B979i_9iBTwnUEU4eVVqZ1pLX3M	2004_lecture_google	Lecture at Google, Collective IQ	https://archive.org/details/XD1955_04GooglePresCollIQ	http://puu.sh/qwMJY.jpg	Lecture
2004	Document	.	2004_pub_hypertext	Augmenting Society's Collective IQ	http://www.dougengelbart.org/pubs/augment-133319.html	http://puu.sh/qwMPS.jpg	None